<?xml version="1.0" encoding="UTF-8"?>

<!--
  This file is part of GTI (Generic Tool Infrastructure)

  Copyright (C)
    2008-2019 ZIH, Technische Universitaet Dresden, Federal Republic of Germany
    2008-2019 Lawrence Livermore National Laboratories, United States of America
    2013-2019 RWTH Aachen University, Federal Republic of Germany

  See the LICENSE file in the package base directory for details
-->

<!DOCTYPE api-specification SYSTEM "/Users/hilbrich/workspace/must/system-builder/dtd/api-specification.dtd">

<api-specification unique-name="HelloWeaverApi">
    <api-headers></api-headers>
    <functions>
    <function return-type="int" name="MPI_Send" wrapp-everywhere="no">
    		<function-arguments>
    			<function-argument order="0" name="buf" type="void*" intent="in" /><function-argument
    				order="1" name="count" type="int" intent="in" /><function-argument
    				order="2" name="type" type="MPI_Datatype" intent="in" /><function-argument
    				order="3" name="dest" type="int" intent="in" /><function-argument
    				order="4" name="tag" type="int" intent="in" /><function-argument
    				order="5" name="comm" type="MPI_Comm" intent="in" />
    		</function-arguments>
    		<analyses>
    			<analysis order="pre" name="PrintSendRecv:print" group="HelloWeaver">
    				<analysis-arguments>
    					<analysis-argument type="mapped"
    						analysis-arg-order="0">
    						<call-arg-name>count</call-arg-name>
    					</analysis-argument>
    					<analysis-argument type="operation"
    						analysis-arg-order="1">
    						<op-name group="HelloWeaver" id="1">getRank</op-name>
    						
    					</analysis-argument>
    					<analysis-argument type="mapped"
    						analysis-arg-order="2">
    						<call-arg-name>dest</call-arg-name>
    					</analysis-argument>
    					<analysis-argument type="operation"
    						analysis-arg-order="3">
    						<op-name group="HelloWeaver" id="1">return1</op-name>
    						
    					</analysis-argument></analysis-arguments>
    			</analysis>
    		</analyses>
    		<operations>
    			<operation order="pre" name="return1" group="HelloWeaver" id="1">
    				<operation-arguments></operation-arguments>
    			</operation>
    			<operation order="pre" name="getRank" group="HelloWeaver" id="1">
    				<operation-arguments>
    					<operation-argument op-arg-order="0">
    						<call-arg-name>comm</call-arg-name>
    					</operation-argument></operation-arguments>
    			</operation>
    		</operations>
    </function><function return-type="int" name="MPI_Recv" wrapp-everywhere="no">
    		<function-arguments>
    			<function-argument order="0" name="buf" type="void*" intent="in" /><function-argument order="1" name="count" type="int" intent="in" /><function-argument order="2" name="type" type="MPI_Datatype" intent="in" /><function-argument order="3" name="source" type="int" intent="in" /><function-argument order="4" name="tag" type="int" intent="in" /><function-argument order="5" name="comm" type="MPI_Comm" intent="in" /><function-argument
    				order="6" name="status" type="MPI_Status*" intent="out" />
    		</function-arguments>
    		<analyses>
    			<analysis order="pre" name="PrintSendRecv:print" group="HelloWeaver">
    				<analysis-arguments>
    					<analysis-argument type="mapped" analysis-arg-order="0">
    						<call-arg-name>count</call-arg-name>
    					</analysis-argument>
    					<analysis-argument type="operation" analysis-arg-order="1">
    						<op-name group="HelloWeaver" id="1">getRank</op-name>
    						
    					</analysis-argument>
    					<analysis-argument type="mapped" analysis-arg-order="2">
    						<call-arg-name>source</call-arg-name>
    					</analysis-argument>
    					<analysis-argument type="operation" analysis-arg-order="3">
    						<op-name group="HelloWeaver" id="1">return0</op-name>
    						
    					</analysis-argument></analysis-arguments>
    			</analysis>
    		</analyses>
    		<operations>
    			<operation order="pre" name="return0" group="HelloWeaver" id="1">
    				<operation-arguments></operation-arguments>
    			</operation>
    			<operation order="pre" name="getRank" group="HelloWeaver" id="1">
    				<operation-arguments>
    					<operation-argument op-arg-order="0">
    						<call-arg-name>comm</call-arg-name>
    					</operation-argument></operation-arguments>
    			</operation>
    		</operations>
    </function>
    <function return-type="int" name="MPI_Finalize"
    		is-finalizer="yes">
    		<function-arguments>
    			
    		</function-arguments>
    		<analyses></analyses>
    		<operations></operations>
    	</function></functions></api-specification>