<?xml version="1.0" encoding="UTF-8"?>

<!--
  This file is part of GTI (Generic Tool Infrastructure)

  Copyright (C)
    2008-2019 ZIH, Technische Universitaet Dresden, Federal Republic of Germany
    2008-2019 Lawrence Livermore National Laboratories, United States of America
    2013-2019 RWTH Aachen University, Federal Republic of Germany

  See the LICENSE file in the package base directory for details
-->

<!DOCTYPE api-specification SYSTEM "../system-builder/dtd/api-specification.dtd">

<api-specification unique-name="MPI">
    <api-headers><header>mpi.h</header></api-headers>
    <functions>
	<function name="MPI_Test_call" return-type="int">


		<function-arguments>
			<function-array-argument name="arg1" type="int*"
				intent='inout' order="0">
				<length-argument type='argument'>
					<call-arg-name>arg2</call-arg-name>
				</length-argument>
			</function-array-argument>
			<function-argument name="arg2" type="int" intent='in'
				order="1"></function-argument>
			<function-array-argument order="2" name="arg3" type="int*"
				intent="in">
				<length-argument type="operation">
					<op-name group="MPI-Check" id="2">
						get_array_length
					</op-name>

				</length-argument>
			</function-array-argument>
			<function-argument order="3" name="arg4" type="int"
				intent="in"></function-argument>
			<function-argument order="4" name="comm" type="MPI_Comm"
				intent="in" />
			<function-array-argument order="5" name="requests"
				type="MPI_Request*" intent="inout">
				<length-argument type="operation">
					<op-name group="MPI-Check" id="1">
						getCommSize
					</op-name>

				</length-argument>
			</function-array-argument>
			<function-array-argument order="6" name="requests2"
				type="MPI_Request*" intent="inout">
				<length-argument type="operation-len">
					<op-name group="MPI-Check" id="1">
						requests2int
					</op-name>

				</length-argument>
			</function-array-argument>
		</function-arguments>
		<analyses>
			<analysis group="MPI-Check" name="check_array_something"
				order='pre'>
				<analysis-arguments>
					<analysis-argument type='mapped'
						analysis-arg-order="1">
						<call-arg-name>arg1</call-arg-name>
					</analysis-argument>
					<analysis-argument type='operation'
						analysis-arg-order="0">
						<op-name group="MPI-Check" id="1">
							get_array_length
						</op-name>
					</analysis-argument>
				</analysis-arguments>
			</analysis>
			<analysis order="pre" name="checkRequests"
				group="MPI-Check">
				<analysis-arguments>
					<analysis-argument type="operation-len"
						analysis-arg-order="0">
						<op-name group="MPI-Check" id="1">
							requests2int
						</op-name>

					</analysis-argument>
					<analysis-argument type="operation"
						analysis-arg-order="1">
						<op-name group="MPI-Check" id="1">
							requests2int
						</op-name>

					</analysis-argument>
				</analysis-arguments>
			</analysis>
			<analysis order="post" name="test" group="MPI-Check">
				<analysis-arguments>
					<analysis-argument type="mapped" analysis-arg-order="0">
						<call-arg-name>arg4</call-arg-name>
					</analysis-argument></analysis-arguments>
			</analysis>
		</analyses>
		<operations>
			<operation group="MPI-Check" name="get_array_length"
				order="pre" id="1">
				<operation-arguments>
					<operation-argument op-arg-order="0">
						<call-arg-name>arg2</call-arg-name>
					</operation-argument>
				</operation-arguments>
			</operation>
			<operation order="pre" name="get_array_length"
				group="MPI-Check" id="2">
				<operation-arguments>
					<operation-argument op-arg-order="0">
						<call-arg-name>arg4</call-arg-name>
					</operation-argument>
				</operation-arguments>
			</operation>
			<operation order="pre" name="getCommSize" group="MPI-Check"
				id="1">
				<operation-arguments>
					<operation-argument op-arg-order="0">
						<call-arg-name>comm</call-arg-name>
					</operation-argument>
				</operation-arguments>
			</operation>
			<operation order="pre" name="requests2int" group="MPI-Check"
				id="1">
				<operation-arguments>
					<operation-argument op-arg-order="0">
						<call-arg-name>comm</call-arg-name>
					</operation-argument>
					<operation-argument op-arg-order="1">
						<call-arg-name>requests</call-arg-name>
					</operation-argument>
				</operation-arguments>
			</operation>
		</operations>
	</function></functions></api-specification>